{"review_id":"2026-05-12-1513-pytorch-trainer","completed_at":"2026-05-12T15:13:43+00:00","final_score":3,"final_verdict":"blocked","verdict_reasoning":"The pipeline regresses three of four stated success criteria from aims.md: no seeding anywhere (reproducibility falsified), load_full_dataset returns the entire dataset with no train/val/test partition (every metric is leakage by construction), and train.py exits without a test-set evaluation. team-data-ml-reviewer returned block (score 3) and lead-project-manager returned block with aim alignment 2/10; lead-senior-architect frames these as symptoms of a missing Experiment boundary. peer-quality-engineer's block (score 2) is the test-side mirror. The fixes are surgical (~55 lines) but the current shape cannot produce a trustworthy metric.","executive_summary":"Full-project review of a small PyTorch tabular-classification trainer. Goal: reproducible baseline MLP with trustworthy metrics.\n\nThe code is small, structurally clean, and largely idiomatic Python. team-security-reviewer found no real attack surface. peer-readability-engineer notes no deep nesting or long functions. team-performance-reviewer notes dominant perf gaps are mechanical one-line fixes.\n\nThe block is on aim alignment, not code quality. Three of four stated success criteria are unmet by construction: no random seeds set anywhere (different loss curves each run), load_full_dataset returns entire dataset with no held-out partition (every metric is in-sample fit), and train.py prints train loss only with no test-set accuracy at exit. lead-senior-architect frames these as four symptoms of a missing Experiment boundary. lead-project-manager grades aim alignment at 2/10 and recommends block-and-rescope (~55 lines: seeding utility, load_splits, test-set pass). Performance fixes should sequence after reproducibility work.","what_is_good":["Security surface is clean — yaml.safe_load used correctly, no secrets, no PII, no network calls.","Code structure is small and readable — no deep nesting, no long functions, structurally clean.","Identified performance gaps are mechanical one-line fixes — num_workers, set_to_none=True, tensor pre-conversion.","The aims document is well-captured and unambiguous."],"what_is_concerning":["Reproducibility falsified: no seeds set anywhere — two runs with the same config produce different loss curves.","Data leakage by construction: load_full_dataset returns entire dataset with no split; every metric is in-sample fit.","Test-set accuracy never computed — train.py exits after training with no test_loader pass.","Per-epoch metric logging is partial and ephemeral: only train loss printed, no val loss, no persistent artifact.","Test suite effectively absent: single test asserts MLP constructs; all success criteria have zero coverage.","Architectural shape blocks fixes: no Experiment boundary owning seeding, splits, and evaluation in one place."],"key_quotes":[{"persona":"lead-project-manager","quote":"Aim alignment: 2/10. Pipeline regresses 3 of 4 stated success criteria — no seeds, no split, no per-epoch metrics file, no test final-accuracy. Nothing it produces can be trusted."},{"persona":"team-data-ml-reviewer","quote":"Project aims commit to reproducibility and no-leakage splits; code falsifies both. No train/val/test split (every metric is leakage), no seeds anywhere (runs are not comparable), and no val loss logged."},{"persona":"lead-senior-architect","quote":"Pipeline has no experiment boundary (no seed, no split, no eval, no metric log) and no testable seams; the aims' success criteria are structurally unreachable from this shape."},{"persona":"peer-quality-engineer","quote":"The test suite contains exactly one assertion — that MLP can be instantiated — leaving the training loop, data pipeline, reproducibility contract, and all success criteria completely untested."},{"persona":"team-performance-reviewer","quote":"DataLoader with num_workers=0 leaves the GPU idle during every batch load — the dominant throughput bottleneck for the 30-minute wall-clock constraint."},{"persona":"lead-project-manager","quote":"Performance findings are off-aim relative to the missing reproducibility and split work. Sequence: reproducibility + split + test accuracy first; perf nits after."}],"stage_reports":{"stage_1":[{"persona":"peer-python-reviewer","score":6,"verdict":"concerns"},{"persona":"peer-quality-engineer","score":2,"verdict":"block"},{"persona":"peer-readability-engineer","score":7,"verdict":"concerns"}],"stage_2":[{"persona":"team-security-reviewer","score":7,"verdict":"concerns"},{"persona":"team-data-ml-reviewer","score":3,"verdict":"block"},{"persona":"team-performance-reviewer","score":5,"verdict":"concerns"}],"stage_3":[{"persona":"lead-senior-architect","score":4,"verdict":"concerns"},{"persona":"lead-project-manager","score":2,"verdict":"block"}]},"aims_snapshot":"A small PyTorch training pipeline for tabular classification. Goal: reproducible runs with trustworthy metrics. Success criteria: reproducibility, train/val/test split (no leakage), per-epoch metrics, final test accuracy number.","casting_roster":{"review_id":"2026-05-12-1513-pytorch-trainer","project_profile":{"type":"ml-pipeline","languages":["python","yaml"],"frameworks":["pytorch","numpy"]},"review_scope":{"kind":"full","description":"full project — all 5 source files"},"casting_reasoning":"Python-only ML pipeline; full-project scope. Stage 1: peer-python-reviewer, peer-quality-engineer, peer-readability-engineer. Stage 2: team-data-ml-reviewer (primary), team-performance-reviewer (30-min constraint), team-security-reviewer (default). Stage 3: leadership unconditional."},"metadata":{"plugin_version":"0.1.0","wall_clock_seconds":0,"models_used":["claude-haiku-4-5-20251001","claude-sonnet-4-6","claude-opus-4-7"],"estimated_cost_usd":0}}
